{
  "schema_version": 1,
  "entity": "brand-identity",
  "asset_id": "builtin:brand:huawei",
  "name": "huawei",
  "colors": {
    "primary": "#CF0A2C",
    "accent": "#232527"
  },
  "typography": "Arial, \"Microsoft YaHei\", sans-serif",
  "tone": "Formal, technical, capability-focused, evidence-led",
  "verification": {
    "status": "verified",
    "verified_at": "未核验**——颜色/字体为公开资料近似值。品牌 deck 交付前必须：① 向客户索取官方 VI token，或 ② 按官方 VI 手册核验主色与字体，并把本文件 verified_at 更新为核验日期与来源；未核验时不得声称「符合品牌规范」；logo 用法（安全区/最小尺寸/深底反白）以官方手册为准，本文件未规定处不得自创。",
    "basis": "legacy-migrated"
  },
  "locked_roles": []
}
